Social Situations,,,Using the restroom,"You are at a restaurant with some friends and go to use the restroom. When you come back to the table your friends are at, they stop their conversation and it's silent. ",https://drive.google.com/file/d/12Y4uqZNuPSg8HgswTCK3obdaz50gCnDn/view?usp=sharing,They didn't expect me to come back so soon. ,Everyone must be noticing my new outfit. ,Everyone is gossiping about me. ,"I might have something on my outfit, but I can go back to the bathroom and clean it off.","They might have been having a good time without me, but that doesn't mean they don't enjoy being my friends. ",I'm thankful for the friends that I have. ,I am interested in joining the conversation. ,I feel defensive. ,"I'm worried that they could hear me in the bathroom, but then remember that everyone uses the bathroom so it isn't a big deal.","I am uncomfortable being around them, but I know that these are my close friends and start to calm down. ",I'll smile at all of them. ,I'll make a joke to break the ice. ,I'll give them a weird look. ,"I want to head home early, but decide to stay as long as everyone else. ","I'll want to text on my phone to avoid talking to them, but remain engaged with my friends. "
Social Situations,Physical Health,,Giving a Presentation,"You have to give a presentation in a meeting today. When you stand up in front of the group, you feel your cheeks get hot and your hands start to tremble.",https://drive.google.com/file/d/1_2rE9XRzKQTqhk0TQjBqftLX-RvYtkqL/view?usp=sharing,It's normal to feel a little warm when you're anxious about presenting. ,I've done everything I can to prepare for this presentation. ,Everyone will see that my hands are shaking. ,"I want to sit back down, but decide to go forward with the presentation knowing my hard work will pay off. ","I want to cover my face, but know I can do this even if it's uncomfortable.",I'm relieved to know this topic well. ,I'm happy with how much I've prepared for this presentation. ,I'm worried that I'm going to pass out. ,"I'm nervous that people can see my hands shaking, but it's probably not as noticeable to them as it feels to me.","I'm scared that my cheeks feeling hot means that I'm going to faint, but I will take a few deep breaths and this feeling will pass. ",I smile and start my presentation. ,I speak with a strong voice.,I ask my boss if I can present another day. ,"I want to go to the bathroom and splash my face with water, but decide to refocus on my surroundings to relax and power through. ","I consider pretending that I'm sick so I don't have to present, but challenge myself to give the presentation anyway. "
Social Situations,Romantic Relationships,,Meeting someone new,"At a work party, your friend introduces you to an attractive friend of theirs you have not met before. The next morning, you notice that they sent you an email.",https://drive.google.com/file/d/1azOE2eRIrdOPl9AdAR61tTkqUFdsq0zB/view?usp=sharing,I think they want to get to know me.,They thought that I was enjoyable to talk to.,They probably meant to email someone else instead. ,"They may stop emailing me after I respond, but they're probably just really busy","They may want to just be my friend, and I'm okay with that. ",I feel flattered that they wanted to email me. ,I'm excited to read their response. ,I feel insecure about maintaining a conversation with them. ,"I'm unsure about the reason they emailed me, but realize it is just because they wanted to. ","I feel worried about what they think of me, but know that I can deal with not knowing. ",I make a joke in my response. ,I talk to my friend about how excited I am.,I ignore their email because I'm anxious about responding.,"I want to ask them why they emailed me, but I decide to just see how things play out.","I'm nervous about sending the perfect reply, but I decide to just be myself. "
Social Situations,,,Not a lot of likes,You decide to reply all to a department-wide email to share an idea. It's been a few hours and no one has responded to your suggestion yet. ,https://drive.google.com/file/d/1h6K5Zfme1ZXvFeEUrUxMpeqnVyoRZwcr/view?usp=sharing,Everyone must be really busy. ,I really like the idea I shared.,People probably think my idea is stupid.,"People might disagree with me, but I'm okay with that. ","Even if people weren't that interested in my idea, I am still glad I shared it.",I feel really proud of my idea. ,I feel happy to be trying new things. ,I feel humiliated.,"I'm frustrated that no one responded to my email, but then I remember that it's only been a few hours.","I feel disappointed not many people liked my idea, but they must just have different perspectives than me. ",I take a break and return to my email later. ,I don't let the lack of response get me down and go about my day. ,I email my friend separately to ask why they think no one has responded.,"I send the other emails I need to send, even though I'm worried about what people are thinking about me. ","I want to pretend that my idea was just a joke, but I fight the urge."
Social Situations,,,Not a lot of likes,You decide to reply all to a department-wide email to share an idea. It's been a few hours and no one has responded to your suggestion yet. ,https://drive.google.com/file/d/1h6K5Zfme1ZXvFeEUrUxMpeqnVyoRZwcr/view?usp=sharing,People haven't checked their email yet. ,I am proud of my idea.,People ignored the idea.,"My colleagues may not like my idea, and I can accept that. ","My suggestion wasn't the best, but I don't have to be perfect. ",I feel brave for sharing an idea to the whole department ,I'm happy engaging with my department.,I feel totally exposed.,"I'm embarrassed that no one liked my idea, but they'll probably forget about it soon. ","I feel disappointed to have not gotten a response, but people are probably still thinking about it. ","The next time my department emails me about an idea, I'll share it.  ",I continue my work without focusing on the email.  ,I dwell on the idea and sulk. ,"I sit and check if anyone has replied, but decide to go out and enjoy the day. ","I want to tell people to forget about my idea, but I leave it as is.  "
Social Situations,Work/Career Development,,Loud friend,"Your car broke down so a friend is dropping you off at a meeting. As they drop you off, they are really loud and everyone in there looks at you. ",https://drive.google.com/file/d/17cJiD1zpyqK4nBNN7ya1mfE9DQlKxJQm/view?usp=sharing,I'm lucky to have a friend who helps me with transportation.,I'm looking forward to this meeting. ,The people at the meeting are going to judge me.,"My immediate thought is that the people at the meeting will be mad at me, but I remind myself that I don't judge people for what their friends do.","We interrupted a lot of people by making so much noise, but they are not likely to remember it or think about it afterward.",I'm excited about this meeting. ,I'm eager to get to the meeting and see people. ,I'm so embarrassed by my friend.,"I'm instantly feeling ashamed of my loud friend, but remind myself that I can't control what they do. ","I'm nervous about what the people at the meeting might say, but they seem really nice and accepting. ",I walk over to the meeting room and start talking to people. ,I put my phone away so I'll be more willing to talk to people.,I go to the bathroom to avoid talking to people. ,"I want to avoid everyone around me, but remind myself that I'll have a better time if I talk to people.","I feel the urge to skip the meeting because I'm embarrassed, but I stay because going to this meeting is important. "
Social Situations,,,Loud friend,"Your car broke down so a friend is dropping you off at a meeting. As they drop you off, they are really loud and everyone in there looks at you. ",https://drive.google.com/file/d/17cJiD1zpyqK4nBNN7ya1mfE9DQlKxJQm/view?usp=sharing,It was nice not to have to take the bus. ,I think about what I want to talk about in the meeting today. ,These people will judge me because my friend is annoying.,"A lot of people noticed the noise we made and may have been annoyed, but it was just for a moment and wasn't a big deal. ","Some people probably do think my friend is rude, but I can't control what my friend does or how people feel. ",I'm energized because this meeting is usually interesting. ,I'm happy to have friends who are willing to help me out. ,I'm ashamed that my friend is so loud. ,"I'm really embarrassed, but remind myself that I can tolerate these feelings and they will pass quickly. ",I feel angry at my friend but remind myself that they are doing me a favor. ,I start getting my notes out for the meeting. ,I smile at my friend as I get out of the car. ,I avoid making eye contact with people. ,"I feel the urge to skip the meeting, but push myself to face my fears and go in. ","I want to keep apologizing to the people in the meeting until I'm sure they're not mad, but I decide that one time is enough. "
Social Situations,Family & Home Life,,Strong opinions,"Your partner has some strong opinions and you don't always agree with them. One evening, you invite a friend over for dinner and sense some possible tension. ",https://drive.google.com/file/d/1KeHog1u5MnwSfzyD9yBj4oIlp2YAyHwf/view?usp=sharing,We will be able to discuss the different opinions thoughtfully.,My friend will be my friend no matter what my partner thinks. ,My partner will say something that makes my friend hate me.,"Even if my partner say something that's upsetting, my friend and I can talk about it later.","If my partner says things that I don't agree with, they're still my partner and I love them. ",I'm happy to have my friend over for dinner. ,I'm calm as we sit and eat dinner together.,I'm worried that my partner will say something embarrassing.,"I'm scared that my partner will say something offensive, but know that what they say is not a reflection on me. ","I'm concerned that my friend will judge me for what my partner think, but am still happy we can get together and talk about it. ",I smile as my friend and my partner talk. ,I practice listening closely with an open mind. ,I snap at my partner and tell them to be quiet.,"I start to tell my partner not to say anything embarrassing in front of my friend, but take a deep breath instead. ","I start a text to cancel the dinner, but remind myself that I really want my friend and partner to get to know each other."
Social Situations,,,Sitting on the bus,You are sitting on the bus and see your friend get on. They walk past you and sit with another friend.,https://drive.google.com/file/d/1jV1VtMwZ0-4W-NqPIDF35GXXbAIeBiM8/view?usp=sharing,I'm able to sit here alone for the rest of the ride. ,My friend probably had something to talk about with the other friend. ,My friend walked past me on purpose. ,"It feels like my friend is mad at me, but they would have said something. ","I really don't like sitting alone, but I know I can handle this short bus ride. ",I'm excited to see my other friends and colleagues at work today.,I'm glad that this is a short bus ride. ,I'm annoyed with my friend right now. ,"I'm scared that people will judge me, but I remember that lots of people ride the bus alone.","I am anxious about why my friend walked past me, but I can ask them about it later.",I call out to my friend and smile. ,I pull out a book and read until I get to my stop. ,I start to cry. ,"I'll want to ignore my friend the rest of the day, but I decide to talk to them instead.","I want to put my head between my knees and disappear, but I take a deep breath and smile. "
Social Situations,,,Sitting on the bus,You are sitting on the bus and see your friend get on. They walk past you and sit with another friend.,https://drive.google.com/file/d/1jV1VtMwZ0-4W-NqPIDF35GXXbAIeBiM8/view?usp=sharing,I think about how I enjoy spending time by myself during my commute. ,Maybe they haven't had a chance to catch up in a while. ,My friend doesn't consider me their friend. ,"I feel left out, but I know there are times that not everyone can be included. ","I would rather have my friend next to me on this bus ride, but that's not always possible. ",I am courageous for sitting on my own.,I am happy that my friends are happy. ,I feel mad at my friend for not sitting with me. ,"I am annoyed that my friend doesn't want to sit with me, but I know that this situation will pass.","I am upset thinking that my friend is mad at me, but I know I should not assume the worst.",I say hello to my friend as they pass. ,I start to journal in my notebook. ,I get flustered and move further away from my friend. ,"I want to get mad and bring up the subject as soon as we get off of the bus, but I know that isn't right so I give my friend some time. ","I want to talk about this with my other friends, but decide to keep this to myself. "
Social Situations,,,Spilled slushie,"You and your friends are out getting dinner. Your food and drinks arrive, and you accidentally spill your drink down the front of your new white shirt.",https://drive.google.com/file/d/16jJWf3eLYQiWH3-6BkyLghQMMaNLxJay/view?usp=sharing,I think about how this is a common accident. ,I think about how it will be a funny story. ,I think I will look silly in front of everyone. ,"I feel like I'm annoying to my friends right now, but they will understand that accidents happen.","I feel like I'm causing a scene, but the other people here don't know me or care about this situation. ",I'm feeling silly and decide to chuckle about it. ,I'm glad that this is an old shirt. ,I feel embarrassed and it's making me want to leave the mall. ,"I'm so annoyed with myself, but am able to get past this feeling. ","I'm self-conscious with this stain, but no one else will care. ","I wipe up the drink, smile, and keep eating with my friends. ",I laugh and order another drink.,I feel like crying and leave the restaurant. ,"I want to leave immediately, but know that I'll forget about the stain soon. ","I want to throw away the food and leave, but I clean up and keep eating. "
Social Situations,,,Hanging out without you,"You are at work and hear some of your coworkers having a conversation behind you. As you listen, you realize that you were not invited to a small gathering, and a few of your coworkers and friends were all hanging out without you. ",https://drive.google.com/file/d/180Vk6BvitDkwytr0yGv0Wb3wtx8-2D8_/view?usp=sharing,It sounds like they had a fun time.,It's nice that my coworkers can spend time together outside of work. ,I wonder if I wasn't invited because they think I'm boring.,"I think they may have forgotten about me, but next time they'll remember. ","I wonder if my coworkers actually don't like me, but then challenge myself to think of times when we've all had a nice time together. ",I feel happy that my coworkers get along so well. ,I feel excited to hear about the fun that they had. ,I feel embarrassed that I wasn't invited. ,"I'm sad that they forgot about me, but then tell myself that they probably didn't intend to be mean.","I'm worried that I've lost all of my workplace friendships, but then remind myself that's not realistic. ",I say something nice to them. ,I reach out to one of my coworkers and let them know I would love to hang out with them next time.,I decide to avoid talking to my coworkers when possible.,"I really want to ask my coworkers why I wasn't invited, but decide that I don't need to ask. ","I want to cry, but remind myself that I've hung out with some of these friends and coworkers without everyone there. "
Social Situations,,,Hanging out without you,"You are at work and hear some of your coworkers having a conversation behind you. As you listen, you realize that you were not invited to a small gathering, and a few of your coworkers and friends were all hanging out without you. ",https://drive.google.com/file/d/180Vk6BvitDkwytr0yGv0Wb3wtx8-2D8_/view?usp=sharing,My coworkers look really happy. ,I think about all the good times I've had with my friends from work.,I think they meant to leave me out of the gathering. ,"I wonder if I was excluded intentionally, but I remember that I've spent time with coworkers without everyone there too.","My coworkers must not actually like me. But, I know that's not the case; we have a lot of fun together. ",I'm calm hearing about what they did. ,I'm glad to have these people as coworkers.,I'm sad that they forgot about me. ,"I worry that they left me out on purpose, but remember all of the times I have been included. ","I'm feeling sad, but decide to think of the good times I've had with my work friends.",I say hi to my coworkers when I see them around our office.,I'll ask some of my coworkers to hang out later this week. ,I cry and think about other times I've been excluded. ,"I want to ignore them for not inviting me, but remind myself that would be childish. ","I want to gossip about how awful it was that I wasn't invited, but decide that would not be helpful. "
Social Situations,Finances,,The Birthday gift,Your friend is having a huge birthday party and most of the people in your friend group will be there. Many of your friends are wealthier than you and can afford to give more expensive gifts. ,https://drive.google.com/file/d/1FK97F0rS8LTIXbo5OdxVuIloeA1-jeHr/view?usp=sharing,I think my friend will be happy to see me. ,I'm looking forward to celebrating with friends. ,My friend will be disappointed with the gift I can afford to bring. ,"I think I am a bad friend, but I know that the gift I'm bringing is thoughtful. ","I assume everyone brought an expensive gift, but I don't actually know if that's true.",I feel grateful to be invited. ,I feel excited to get the party started. ,I feel sad that I don't make as much money as my friends,"I feel ashamed, but decide that thoughtful gifts are more meaningful than expensive ones.","I feel guilty about bringing a cheaper gift, but remind myself that my friend will probably still appreciate it.",I stay at the party. ,I walk in and hug my friend. ,I decide to stay for an hour and leave. ,"I want to leave before the presents are opened, but decide to stay. ","I think about lying that I forgot the gift at home, but I give it to my friend."
Romantic Relationships,Social Situations,,No response,You've been texting with someone you really like and they're usually quick to respond. You notice that they saw your message a couple of hours ago and did not respond. ,https://drive.google.com/file/d/1NvTM1g3vx1Kut8y_4vvBJo79qKHzUztk/view?usp=sharing,They're just busy. ,I am a nice person to talk to.  ,They must not like me.,"They may think I'm boring, but no one is interesting all the time. ","They may not be interested in me romantically, but I can move on to someone else.  ",I'm happy with who I am whether they respond or not. ,I feel okay that they haven't responded. ,I'm embarrassed that I put myself out there.,"I feel bad about not getting a quick reply, but remember I don't need to try and control the situation. ","I'm anxious that I haven't heard back, but realize that I don't need to hear back immediately about what I sent.",I keep going with my day.,I call a friend and ask them about their day. ,I send a bunch of messages back to back to see if they respond. ,"I want to ask what they think of me, but decide to give it more time. ","I want to spend my day focused on my phone, but instead do hobbies I enjoy. "
Romantic Relationships,Social Situations,,No response,You've been texting with someone you really like and they're usually quick to respond. You notice that they saw your message a couple of hours ago and did not respond. ,https://drive.google.com/file/d/1NvTM1g3vx1Kut8y_4vvBJo79qKHzUztk/view?usp=sharing,They must have a lot to do today. ,They'll get back to me when they have time. ,They will never respond to me. ,"Maybe I'm annoying them, but they also might just be busy.","If they like someone else and not me, I won't like it, but I'll move on from it. ",The anticipation of waiting to hear back feels exciting. ,I feel happy with my ability to send fun messages. ,I'm upset that they didn't respond immediately. ,"I'm worried this has something to do with me, but realize this person has a lot of other things going on in their life. ","I'm sad that they didn't respond quickly, but know that I won't feel sad forever. ",I reach out to a friend. ,I start working on other important things I want to do today.,I cancel my plans for the day. ,"I want to remove them from my phone, but decide to give the situation some time and cool off. ","I want to send a bunch of messages to this person, but instead call a friend. "
Romantic Relationships,,,Attractive person on social media,"While scrolling through a dating app, you see an attractive person you met at the grocery store last week. You decide to like their profile. ",https://drive.google.com/file/d/1cZuUvxfxc9jrn57Y99LQosxbvUvv8V-R/view?usp=sharing,I hope we can continue the great conversation we started at the store. ,I think about how we could go on a date. ,This person will think I'm weird for liking their profile.,"I think about whether they'll think my photos are silly, but then remind myself that I'm proud of my profile. ","I wonder if they think I am attractive, but remind myself that looks aren't everything. ",I feel happy that I liked their profile. ,I feel excited I have a romantic prospect. ,I'm scared that I'll never find someone who's interested in me romantically.,"I feel embarrassed by some pictures I have up, but decide to feel confident about them. ","I feel shy about liking their profile, but decide to be excited about the opportunity.",I send them a message to start the conversation.,I tell my friend about how I liked their profile. ,I delete all of the pictures that might be embarrassing.,"I want to deactivate my account, but decide to keep it up. ","I want to change some of my pictures, but keep them the same. "
Romantic Relationships,Social Situations,,Spilled Coffee,"You’re on a date at a coffee shop with a person you really like. As you walk back to the table, you trip and fall and spill coffee everywhere.",https://drive.google.com/file/d/1ijt0ecisBDCbnP9iQ5cHp7WQlGPwmTpO/view?usp=sharing,This has probably happened to a lot of people. ,This will be a great icebreaker when I start talking to my date!,I look like a total klutz in front of my date. ,"My date might think I'm a bit clumsy, but they probably don't really care. ","I wish I'd been a bit more careful, but I'm human and it happens.",I feel lucky I didn't hurt myself.,I'm confident that we'll have a great conversation.,I feel like a fool. ,"I'm upset that the date started off this way, but it might help us feel more comfortable talking to each other.","I'm embarrassed that I tripped in front of my date, but this feeling will pass.",I laugh with my date about my spill. ,I clean up and buy another coffee.,I end the date early because I'm so embarrassed.,"I feel the urge to avoid talking to my date after this, but I decide to ask them if they want to hang out again.","I feel like crying, but take a deep breath. "
Romantic Relationships,Family & Home Life,,Clashing viewpoints ,"You and your partner both have strong opinions and you don’t always agree with each other. Over dinner one evening, you get into a heated argument about a topic that is a passion of yours.",https://drive.google.com/file/d/1CY5PLw_DW_F4ZZCed1eIaQEOb-3QH5ru/view?usp=sharing,This is such an important issue to be discussing. ,My partner is really smart and thoughtful.,Our relationship is going to end over this argument. ,"I believe that I'm right, but I choose to accept that we might just disagree on this point.","Even when my partner and I are mad at each other, I know we still care about each other deeply.",I'm grateful to have a partner who cares so much about important issues.,I feel respected as we discuss our differences in opinion.,I'm furious that we don't see eye to eye on this. ,"I'm upset that we got into a fight, but hopeful that we can move forward from this. ","I'm disappointed that we disagree on this point, but I know it's normal for couples to have disagreements. ",I try to see things from my partner's perspective to understand where they are coming from. ,I explain my views calmly and clearly.,I threaten to break up with my partner if they don't agree with me.,"I want to yell at my partner, but I take a few minutes to calm down before returning to the conversation.","I want to lock myself in my room, but decide that avoiding my partner won't be helpful in the long run."
Presymptomatic,,,Symptom Onset Fears,,,,,,,,,,,,,,,,,
Physical Health,Work/Career Development,,Walking up stairs,"You are meeting with your boss. To make it on-time, you just walked up two flights of stairs quickly, and feel your heart beating very rapidly.",https://drive.google.com/file/d/1l0VcV571sh8CPMn2No5S-IgUUDRsgLq_/view?usp=sharing,I am excited for the meeting. ,I made it up those stairs really quickly. ,Am I having a heart attack? ,"It's scary to feel my heart beating fast, but I know that it will be over soon. ","My boss might notice how out of breath I am, and it's okay if they do. ",I'm happy I made the meeting on time. ,I'm feeling excited now that my blood is pumping. ,I'm worried that there's something really wrong with me. ,"I feel embarrassed about being out of breath, but I'm able to focus on what my boss has to say. ","I'm worried that something's wrong with me, but I remind myself that it's normal to feel out of breath after walking up a bunch of stairs. ",I take a few deep breaths. ,I take a few sips from my water bottle. ,I start looking up symptoms of a heart attack online to see if I'm dying. ,"I feel the urge to tell my boss that something's really wrong with me, but remind myself that I'm actually OK. ",I want to panic but remind myself that it's actually just my body's reaction to coming up the stairs quickly. 
