Family & Home Life,Mental Health,,Missing spider,"As you're getting into the shower, you see a huge spider on the wall. You turn away for a second and look back and realize it's gone. ",https://drive.google.com/file/d/1EUMVkI6asoBt7l80JfW7XQ4KWT27fZDe/view?usp=sharing,I'm glad it's gone. ,I think it went back to it's home.,It's going to crawl on me!,"I think about how it could bite me, but remember it is probably trying to avoid me and the water.","I think about how it could be venomous, but realize the chances of that are slim. ",I'm curious where it went. ,I'm calm as I get into the shower. ,I'm scared the spider will show up when I least expect it. ,"I'm anxious about getting into the shower, but know I can overcome my fear. ","I'm grossed out, but remind myself that the spider probably can't hurt me. ",I decide to turn the water on. ,I start to play some music. ,I scream and run away. ,"I want to call someone to help me find the spider, but decide to just take my shower. ","I want to spray bug spray everywhere, but decide to continue my shower routine since spray might do more harm than the spider."
Family & Home Life,,,Babysitting,You are looking after a friend's child and you're watching TV while they sleep. It's dark outside and you suddenly hear noises against the window. ,https://drive.google.com/file/d/11Vs9sz9BDAkaj5QCxD927t-mz-VTFWXn/view?usp=sharing,I think it must be the wind.,I think about how there are lots of animals outside at this time.,I think about how someone could be trying to break in. ,"Even though my brain automatically goes to the worst case scenario, I remind myself that I'm probably safe.","I notice that I'm assuming the worst is going to happen, and remember that everything will actually be OK. ",I'm happy to be helping out my friend by looking after their child.,I'm tired and am looking forward to going to bed.,I feel scared that I don't know what made that noise.,"I feel terrified, but realize my brain is being very imaginative.","I'm worried about what's outside, but remind myself that it was probably the wind.",I pull out a new book and start reading.,I make some popcorn and turn on the TV.,I call the friend to come home immediately. ,"I want to leave the house, but decide to stay. ","I want to wake up the child and ask if they hear anything, but instead let my anxiety pass. "
Family & Home Life,,,Babysitting,You are looking after a friend's child and you're watching TV while they sleep. It's dark outside and you suddenly hear noises against the window. ,https://drive.google.com/file/d/11Vs9sz9BDAkaj5QCxD927t-mz-VTFWXn/view?usp=sharing,There are lots of noises at night. ,It is quieter at night so it's easier to hear lots of things. ,I wonder if I'm in danger. ,"My brain immediately thinks that there's something dangerous outside, but I remind myself that I'm probably safe. ","I picture something trying to get me, but then tell myself that it was most likely the wind on the window. ",I'm excited to see my friend and hear about their night out. ,I'm happy that my favorite show is on TV.,I feel worried that something is looking into the window.,"It makes sense that I was scared at first, but remind myself that I'm probably safe.","My heart is beating a little faster than it was before I heard the noise, but I know that it'll go back to normal soon. ",I put on a funny movie. ,I decide to play some of my favorite music. ,I call my partner and start crying. ,"I feel the urge to hide, but tell myself that it was probably nothing outside.","I want to call my friend to have them come home soon, but tell myself that I can face my fear and that the anxiety will go away."
Family & Home Life,Physical Health,,Aging family member,You go to your parents' home for the first time in a while and notice that your father looks a lot less healthy than you remember. Neither one of your parents mentions anything about his health. ,https://drive.google.com/file/d/1--Dsh79NQFoIe97rn3Clv7DVEK8PAaTM/view?usp=sharing,I want to make the most of my time with my father.,He's happy to see me. ,My father must be dying.,"I think about how miserable I will be when he passes away, but then remind myself to enjoy my time with him today. ","My parents must be keeping a secret about his health, but then tell myself that everyone ages. ",I feel happy to see my father.,I feel excited to catch him up on all the new things that are going on in my life. ,I'm worried about how he looks. ,"I'm scared to lose him, but know that I can handle grief. ","I feel anxious about his health, but tolerate the anxiety. ",I decide to give him a big hug and smile. ,I make a funny joke to get my parents laughing. ,I don't speak to my parents because they didn't tell me he was sick. ,"I want to leave and cry, but decide to stay with the family and engage in conversation. ",I notice my sadness but gently ask my father how he's doing and accept any answer he gives me.
Family & Home Life,Physical Health,,Aging family member,You go to your parents' home for the first time in a while and notice that your father looks a lot less healthy than you remember. Neither one of your parents mentions anything about his health. ,https://drive.google.com/file/d/1--Dsh79NQFoIe97rn3Clv7DVEK8PAaTM/view?usp=sharing,He looks so happy to be with family. ,My father is glad that I'm visiting. ,He's probably going to pass away soon. ,"I wonder what is going on with his health, but reassure myself that my family takes care of him. ","I think about whether my parents are keeping something from me, but tell myself that I can't control my father's health. ",I am grateful to be able to spend time with my father.,I feel thrilled that my father is engaging in conversation. ,I'm uneasy about my father's appearance. ,"I start to feel angry about how he is getting older, but know that this is a part of life and I cannot change it. ","I feel anxious and start to overthink what could be wrong, but remember I can't control his health.",I start to make conversation with my family. ,I laugh at something silly my father said. ,I avoid thinking about his health.,"I want to question the family on his health, but decide to enjoy the gathering. ","I feel the urge to ask about his health, but take a deep breath and listen to what my family is talking about now knowing that there's a reason they haven't told me anything. "
Family & Home Life,Mental Health,,Missing spider,"As you're getting into the shower, you see a huge spider on the wall. You turn away for a second and look back and realize it's gone. ",https://drive.google.com/file/d/1EUMVkI6asoBt7l80JfW7XQ4KWT27fZDe/view?usp=sharing,The spider's movements are really interesting.,The spider isn't going to hurt me.,It's going to jump on me!,"I think about all of the places the spider could be, but I can't control what it's doing.","I think about how scary the spider looked, but also how small it really was. ",I'm going to feel so refreshed after this shower.,I'm grateful the spider is here to eat other bugs in my house.,I feel worried about where the spider may crawl next. ,"I'm nervous about the spider, but remind myself that it probably is more scared of me.","I feel freaked out, but know that I'm brave enough to take my shower anyway.",I put on my favorite song and hop in the shower.,I go on with my bathroom routine.,I leave the bathroom immediately and don't take a shower. ,"I want to run away, but decide to stay and face my fears.","I want to scream, but instead gently move the spider outside."
Early/Mid-Stage Symptoms,,,Symptomatic in Public,,,,,,,,,,,,,,,,,
Early/Mid-Stage Symptoms,,,Symptomatic in Public,"A random person comes up to you to ask you a question, but all you can manage in response is a quiet mumble they can't hear. You start wondering what their response will be.",https://drive.google.com/file/d/1aAOQBeFgBrn0pCS_3eath34IXjU9eIaw/view?usp=drive_link,They will be patient with you.,They assume that their hearing was just not good enough and will just ask you to repeat what you said.,They think you're being rude to them.,"It may be difficult to speak up, but I will still be able to express myself.","I rue the condition I'm in, but know that I will adjust.",I'm happy that I was at least able to talk.,I'm confident this person won't be rude to me in response.,I'm scared the person will yell at me.,"I'm worried that I might come across as rude, but I trust that the other person has enough patience not to immediately assume the worst.","I'm worried what the look on his face in response means, but I can get through this.",I accept the situation I'm in and do my best to think of alternative ways of communicating.,I try to smile to show that I am not being rude.,I turn away before the person has a chance to respond to avoid any potentially negative interaction.,"I feel like avoiding the interaction after, but I meet their gaze to try and convey that I am engaged with them.","I want to express my frustration at this difficulty, but I accept this is my condition and do my best."
Early / mid stage symptoms,,,Watching the Game,"You are at a sporting event with some of your friends, sitting in a crowded section with them. During the game, you feel like your dyskinesia is especially noticeable, and you wonder if the people sitting near you will find this annoying.",https://drive.google.com/file/d/1B-MKc2nNGWu6qxgtdovLHNchSe-JA2Ql/view?usp=sharing,This sporting event is fun.,The people around me don't even notice my symptoms.,The people sitting near me think I am distracting.,"I don't know what the people around me think of me, but I am with my friends who will support me no matter what.","I can't control my body's movements all of the time, but that is something I can live with.",I feel excited to watch the game.,I am happy to spend time with my friends.,I feel bothersome for moving around in my seat.,"I feel anxious about possibly annoying those around me, but I'm not the only one who isn't sitting perfectly still.","I feel upset about not being able to control my arms' and hands' movements, but I know that it doesn't mean I am any less of a person.","I explain to those around me why I keep moving, so they understand.",I talk to my friends during the game so I'm not focusing on the other people around me.,I go stand by myself to avoid bothering people around me.,"I focus on the game, despite feeling uncomfortable in my crowded section.","I want to ask those around me if I'm bothering them, but instead I cheer on the team to fit in."
Early / mid stage symptoms,,,Partaking in Hobbies,"You used to love taking on random hobbies like knitting, painting, or trying new sports. With the progression of your symptoms, you wonder whether you will be able to keep up with these tasks.",https://drive.google.com/file/d/1CJbDbhjElXse_-RdyTb8kaeDBape75aL/view?usp=sharing,I can adapt to whatever symptoms I develop.,I will enjoy finding new hobbies to try.,I am useless with my symptoms.,"Though my hands don't work the same as they used to, I am still capable of tons of things.","I think there are hobbies out there for me, even if I have to do them differently.",I feel excited to find new hobbies and do them in my own way.,I feel confident in my abilities.,I am sad that my symptoms could get in the way of something I enjoy.,"I feel frustrated when I can't do something as easily, but if I take my time, it feels just as rewarding to do it.","Even if my hands make some hobbies difficult, I feel optimistic that I have things that I enjoy doing.",I find a new hobby that works for me.,I find new ways to do the hobbies I love.,I stop taking on new hobbies.,"I'm not able to do all of my old hobbies by myself, but I ask for help for pieces I'm not able to do anymore.","I want to stop taking on hobbies, but I do research to find out what others with my symptoms do for fun."
Early / mid stage symptoms,,,Chat Over Coffee,"You are getting coffee with somebody you haven't seen in a few weeks. During the conversation, you frequently have trouble speaking and begin to wonder if your friend is getting annoyed with you.",https://drive.google.com/file/d/1Opym9PDaZ66W3j3cy6phbjDnrX-W2_ng/view?usp=drive_link,It is great to hear what my friend has been up to.,I am glad that my friend is supportive and understanding with my condition.,My friend thinks I'm being rude to them.,"I think my speech must be really hard to understand, but I remember that my friend has been patient with me before.","My friend might be annoyed, but I know they are understanding of my condition.",I am happy to be here with my friend.,I am excited to tell my friend all about my life recently.,I am scared that my friend will suddenly run out of patience with me.,"I am nervous that people will be judgemental about how I am speaking, but I can spend my time with people who appreciate me.","I feel frustrated trying to get my words to come out differently, but my friend just looks happy to see me.",I ask my friend if we can go outside where there is less background noise to make it easier to talk.,"I pause for a few seconds to let the frustration go, so I don't get angry.",I will tell my friend I have to leave so I don't annoy her.,"I want to stop talking completely, but I pause for a moment and try again.","I want to rush through this so I can leave, but I take a deep breath and appreciate getting to see my friend."
Early / mid stage symptoms,,,Preparing for a Dinner Party,"You planned a dinner party a few weeks ago and the day has finally come. As you begin preparing for it, you notice you are feeling more fatigued than usual.",https://drive.google.com/file/d/1no1kdTmC_SpE4cqvdpUfTEhpT4BNcqQR/view?usp=drive_link,The dinner will be enjoyable.,My friends will be grateful I planned this.,My symptoms will prevent me from finishing the meal in time.,"I may not be able to finish all of this cooking alone, but my guests will be happy to help.","Even if I finish a little after all my friends arrive, they will be fine waiting.",I am grateful to be able to host my friends.,I feel happy to bring people together.,I'm really frustrated that my symptoms are getting in the way of something I care about so much.,"I feel nervous that people will notice I'm not feeling well, but they would not hold that against me.","I feel down that I can't do what I set out, but I know what really matters is that I will see all my friends in one place and have a good meal.",I slow my actions down and take my time.,"I pull up a chair, so I don't have to strain myself as much while preparing the food.",I will ignore how I feel and not ask anyone for help.,"I don't want to tell anyone and worry them, but I let everyone know to practice clear communication.","I want to force myself to behave like I would if I was feeling better, but I let myself rest when I need to, instead."
Early / mid stage symptoms,,,Writing a Grocery List,"You plan on buying groceries later today and decide to make a list. When writing the list of things you need, you realize your handwriting is starting to get worse.",https://drive.google.com/file/d/1X4fo8bSlYVfkXYuTJXPSQ-S_ENPjksaw/view?usp=drive_link,I am still able to make a list in my mind.,I am still able to write with a pen and paper.,I should never write by hand again.,"Writing is starting to make me nervous, but I keep in mind that I still can.","Although I may not write as well as before, I can still express myself.",I am eager to find other ways to express my thoughts.,"I am happy that there are devices that can assist me in making lists, like my phone, if I need them.",I am worried about being too dependent on others.,"I do not like that my handwriting has changed, but seeing that I can still write fairly legibly is assuring.","I will miss the times where writing was not a struggle, but know that it will not stop me.",I can ask my family to help me write what I need.,"I can use other tools to keep track of my list, like my phone.",I will never write anything again because it won't be legible.,"I am able to write the list, it just may take longer than before.","My handwriting might not look neat, but I can still convey myself through writing."
Early / mid stage symptoms,,,Spilling Water,"Before leaving for an appointment, you decide to eat breakfast at home. While finishing up, your hand shakes, causing you to spill water all over your dress shirt.",https://drive.google.com/file/d/1O_G61MSRB33WpZ35Q0ebLh24ZHEQgizs/view?usp=drive_link,"This happens to people all the time, regardless of if they have a movement disorder or not.",I am safe and nothing harmful happened.,I can never drink something by myself again because it will always spill.,"This is inconvenient, but I will still make it to the appointment on time.","I will not be able to dry my shirt in time for the appointment, but I have other clothes I can wear.",I am grateful that I did not hurt myself.,I am glad I got to enjoy my breakfast.,I feel frustrated for not having more control of my body.,"Although I feel embarrassed, no one was around to see it.","I am sad that I have symptoms affecting my ability to do daily tasks, but I am still able to get through my day.","I am still home, and can easily change into a new shirt.","I will be able to dry the spill, and no one will know it happened.",I should stay home and not go out in public because I cannot drink water properly anymore.,"Although I felt a moment where I couldn't control myself, I now am able to fix the situation.","Although I made a mistake, I did not do it on purpose."
Early / mid stage symptoms,,,Getting Dressed for Work,You are getting dressed for the day when your fingers become unsteady. You realize you will have to ask your partner to help you finish closing your buttons.,https://drive.google.com/file/d/1iOSwwtGXHr63uVC9bpx3282nHJeeE1On/view?usp=sharing,My partner cares about me and wants to support me.,My partner will be happy knowing that I trust them enough to ask for help.,My partner will think I'm incompetent.,"This is a challenge for both of us, but communication will help us navigate this new dynamic.","I am scared what my partner will think, but I know that they will be understanding of the situation.",I am proud of myself for seeking help and addressing my needs.,I am grateful to have such a supportive partner.,I'm embarrassed about needing help for such a simple task.,"It's understandable to be frustrated, but I can trust my family to support me.","I feel embarrassed, but my partner is understanding and grateful I trusted them to help me.","I will buy clothing without buttons, so that I can dress more independently in the future.",I will try my best to finish getting ready by myself before asking my partner for help.,I will change outfits and never tell my partner about this.,I will change outfits and dress myself but will tell my partner about this later today.,"Even though I want to change outfits and pretend this never happened, I will ask my partner to come help me."
Early / mid stage symptoms,,,Dropping Fork,You are having lunch alone at a restaurant. You feel your hands become unsteady and begin to drop your fork while trying to eat.,https://drive.google.com/file/d/13pFCrKy7Z0cexCWeM6M41qgoMhnqQbzh/view?usp=sharing,I can give myself a break before trying again.,"Food is meant to be enjoyed, if I have to eat slow, it is not a bad thing.",People are probably judging me after hearing the fork drop.,Just because someone seems to be looking at me doesn't mean they are judging me.,I am worth more than how others perceive me.,I am grateful for this time I can spend by myself.,I am happy to treat myself and eat out.,I am embarrassed that I no longer have total control my body.,"I may feel frustrated, but I can practice being patient with myself.","Although I'm upset that some tasks are more difficult for me now, I can still enjoy my outing.","I will take a deep breath, stretch my hands, and try again.",I will ask the waiter for an extra fork in case mine drops to the floor.,I will give up on my meal and avoid going out in the future.,"I will share this experience with my family, and we will research exercises people with my symptoms have said were helpful.","I want to go home now, but I finish my meal and try to relax afterwards."
Early / mid stage symptoms,,,Family Reunion,"You have been invited to a family reunion. Because you've been having more difficulty with your balance lately, you are unsure of how the event will go.",https://drive.google.com/file/d/1E4KVLb-fFP8xt7ayzB42eO8GBkdPJYJQ/view?usp=sharing,The family reunion will be fun.,It will be nice to catch up with family members.,The other family members will be judgmental.,"I may trip and fall, but it is likely that people will be understanding.","I will probably be unsteady on my feet, but at least my partner is going with me and can help.",I feel excited about seeing my family members.,I feel comfortable asking my partner or other family members for help.,I feel embarrassed about falling in front of so many people.,"It may be embarrassing to fall in the moment, but I will be able to get over it.","I feel like a burden, but my partner assures me that I am not.",I will bring my assistive device to help me remain steady.,I will express my worries to my closest relatives who are going so that they can help.,I will decide not to go to the reunion.,"I am scared of how people will perceive me, but I know there is strength in even showing up to the event.","I am very tempted to ditch the reunion, but I know the important thing that matters is seeing those who I haven't in a while and enjoying each others' company."
Early / mid stage symptoms,,,Movie with the Kids,You are enjoying a movie at the theatre with your grandchildren. You begin to feel uncomfortable as your limbs become stiff.,https://drive.google.com/file/d/1MmLtIsugNJukTRNfyZ6aEkWS_elRzS45/view?usp=sharing,I can still relax and enjoy the movie.,It is nice to get a chance to hang out with my grandchildren.,"The movie is close to finishing, and I'm scared that I will probably struggle to get up.","Even though I am very frustrated, I can still focus on enjoying this movie with my grandchildren.","Even if I am upset, I am still enjoying the movie.",I am grateful to be able to see this movie with my grandchildren.,I am proud of myself for remaining calm.,I am angry at myself for coming to the movie while having these symptoms.,"I feel embarrassed about moving and trying to get comfortable, but people are focusing on the movie, not me.","Although I am feeling anxious, I feel happy to be spending time with my grandchildren.","I will leave the theatre for a minute, so I can stretch to try and feel better.",I will bring medication for emergencies in the future.,I will leave the movie and go home.,"I am uncomfortable, but I enjoy spending time with my grandchildren when I can.","I am itching to leave and abandon the movie, but seeing my grandkids enjoy it so much makes it all worth it."
Early / mid stage symptoms,,,Tired But Busy,You had to wake up earlier than normal to travel to a doctor’s appointment today and now feel overtired. You wonder how you will manage to complete the errands you planned for the day.,https://drive.google.com/file/d/1C5eyffITSPSxUQbsggbodHcx8FpZhTu9/view?usp=drive_link,I can always change my plans.,I am capable of completing the tasks.,"I won’t be able to complete any tasks today, so I shouldn't even try.","Although I am tired, I will be able to rest beforehand.","I'm frustrated at the thought of not being productive today, but everyone experiences days like those, even people without PD.",I am glad I can now rest after the appointment.,I am eager to start and complete another task.,I am groggy and irritated.,"Although I am more annoyed than usual, I am grateful I went to the doctor’s appointment.","I am very tired, but the thought of being out and about is giving me the boost to keep going.",I will take a nap before starting another task.,I will complete a manageable chore after arriving back home.,I will avoid all tasks and people.,"Even though I want to do nothing and give up on the day, I know that I'll feel a lot better later on if I at least do one more thing.","Even though I want to scream in frustration at my body, I know that getting sleep and rest is a good thing for me to do."
Early / mid stage symptoms,,,Game Night,"You often have game night with your family and tonight you are all playing a board game. While setting up the pieces, you get frustrated with your inability to handle the game pieces smoothly. You wonder how the game will go.",https://drive.google.com/file/d/1RYuZK8b0iI3WNP1R39lrhzMZsf3Bgz3A/view?usp=drive_link,I will enjoy the game despite this difficulty.,I will experience important quality time with my family.,My struggle with playing will ruin the game for everyone.,"Even though I play differently now, it is still enjoyable.","Although it takes more time for me, I am still grateful to share my evening with loved ones.",I feel comfortable in my own home with close family.,I am enjoying the entertaining game.,My struggle has made the night more unpleasant and off-putting.,"I feel disappointed in my abilities, but know the game will still be fun.","I am upset that I can’t take my turn as quickly, but am pleased with the game night regardless.",I engage with my loved ones and enjoy my time with them.,"I continue to play my turn at a slower, more comfortable pace.",I will pretend I do not enjoy the game to have an excuse not to participate.,"Although I'm feeling frustrated, I will let my family members know how I am feeling so they can support me.","Although this is more difficult, I can research tips on how to manage and have my loved ones’ support."
