 ,SESSION 1 TRAINING,,,,,,,,,,,
Dentist appointment,"You have a routine dentist appointment and find out that you need some tests to check the health of your gums and teeth. After the dentist performs the tests, you continue to lie in the dentist chair while waiting for the results. You think the news from your dentist will be that your gums are",,https://drive.google.com/file/d/1PUQshZgNL6tX5cS4aP636BXA9VNXNVpq/view?usp=sharing,phys_011,healthy,Do you think you have gum disease?,N,positive ,4,,,
Running out of time,"You are taking a test in your environmental science class. You only have ten minutes left and you still have three long problems to get through. When you think about your ability to complete the test, you feel",,https://drive.google.com/file/d/10SQmYfVuHzcGYJjADi5bmTtG4gXr2V9x/view?usp=sharing,aca_076,doubtful,Will you be able to finish your test in time?,N,negative,,,,4
First time ice skating,"Your friend enjoys ice skating and convinces you to try it out. At the rink you put on the skates and step on the ice. You glide forward slowly at first, then faster, and think your chances of getting injured are",,https://drive.google.com/file/d/1aAVB9kwWR539576_DqNHC99nsv-5mvLt/view?usp=sharing,gen_008,minimal,Are you excited to try ice skating?,Y,positive,1,4,,
,,,,,,,,,,,,
,HOME LIFE ,,,,,,,,,,,
Scenario,Scenario,,Image ,Variable name,Ending word(s),Comprehension Question,Y/N,"Type of ending (positive, negative, or resilence) ",,,,
Different opinions,"You invite your friend over after school and your parents are home. Your parents are pretty opinionated and may say something embarrassing to your friend. As you and your friend walk into your home, you are",,https://drive.google.com/file/d/1bI1F-c5_vDfCHfyyO6kkJ_mSrcbL49R6/view?usp=sharing,hom_012,calm,Are you anxious as you and your friend go into your home?,N,Positive,2,5,,
Lots of family members,"You live with a few extended family members. Your friend asks if they can come over after school to study, and they don't know how many people live in your home. As you picture your friend coming into your home, you think they will be","You consider that you live in a different situation compared to your friend. You also know that your friend is really nice, so will be ",https://drive.google.com/file/d/1gOgWMSmj9SUOfxHrpkgHpZkmIMjWY3Yq/view?usp=sharing,hom_020,surprised; accepting,Does your friend judge you for living with lots of extended family members?,N,Resilience ,2,,,
Smelly food,"You and some friends are watching a movie at your home. At the end of the movie, your friend asks what that funny smell is. You know that's your dinner, and when you think about how to answer you feel",,https://drive.google.com/file/d/1ycooBDYhbqicxiNW3ADymBujgdMVhh8h/view?usp=sharing,hom_013,hungry,Are you anxious about telling your friend that the smell is your dinner?,N,Positive,2,5,,
Cultural celebration,"Your friends ask you to go to a concert, but it's the night of an important cultural celebration for your family. You are looking forward to the celebration with your family, but don't want your friends to think you're lame. As you think about telling your friends, you realize that your culture is ",,https://drive.google.com/file/d/1ooVd4XP2M8uvAgD3jqy3SN9TjXcZXBCO/view?usp=sharing,hom_016,important,Are you embarrassed to tell your friends that you can't go to the concert?,N,Positive,2,5,,
Dent on the car ,"Your family shares one older car that has a big dent in the front. Today your parent has to drop you off at school because you are running a little late. When you think about your classmates seeing your parent's car, you feel","As you're getting out of the car in front of the school, you see your group of friends. They smile and wave at you, and you feel",https://drive.google.com/file/d/1mOlMHP980_j_w9ymOJWVqOKB1T-y77dx/view?usp=sharing,hom_018,nervous; relieved,Do your friends judge your parent's car? ,N,Resilience ,2,5,,
Differences,"You want to go to college, no one in your family has gone to college yet. You think about how your family will react when you tell them your decision and they may not like the idea of you going to college. As you imagine telling them, you feel",,https://drive.google.com/file/d/1mfPOr__w6g_DX68Qv4rp11wDL15AzfTN/view?usp=sharing,hom_017,excited,Are you worried about telling your family that you want to go to college?,N,Positive,2,5,,
Bilingual family,"You invite your friend over for dinner, and while you're eating, your family switches back and forth between English and another language. You never told your friend that your family members are bilingual. You think about your friend's reaction, and think that she'll think it is ",,https://drive.google.com/file/d/1vTuw-1aglVPbYE4oaEYbIP6LLuikDSFt/view?usp=sharing,hom_019,interesting,Is your friend judgmental of your bilingual family?,N,Positive,2,,,
Low score on test,You have recieved a poor score on a test and your guardian has to sign off on it since the grade is low. They don't say anything when you show them your test. They are probably feeling ,,https://drive.google.com/file/d/1Srg7WWskU86agc1Xzr0g_QYySWH4zGS8/view?usp=sharing,hom_006,disappointed,Is your guardian disappointed that you got a bad grade?,Y,Negative,2,5,,
Reading a poem,"You have been invited to a friend's house for a holiday and you want to bring a gift, but can't afford to buy one. You decide to write a poem and recite it for their family. As you picture yourself reading it, you feel ",,https://drive.google.com/file/d/1gqs34RS_CsCnUbNlLaEigxSxuKvzjTSX/view?usp=sharing,hom_021,excited,Are you worried about reciting a poem for your friend's family? ,N,Positive,2,,,
Sleepless night,"Your neighbors were really loud last night so you couldn't sleep. You have a huge test this morning in your least favorite class. As you think about how you'll do on the test, you feel",,https://drive.google.com/file/d/1HsDUCeU29zHEdpx6zFJUNO-bHxtE6WBU/view?usp=sharing,hom_022,prepared,Are you ready for your exam?,Y,Positive,2,,,
,Great job with those scenarios in your domain! Now you'll get to practice a few more scenarios that are from other domains. This will help you apply your flexible thinking skills to lots of different types of situations!,,,,,,,,,,,
Embarrassing stories,"You invited your caregiver to a school event tonight. You know that they can sometimes tell embarrassing stories about you to other people. You think about what they're going to do tonight, and feel",,https://drive.google.com/file/d/1oGNnBFehUdYBlSikTmSsRaaBV3kbk94x/view?usp=sharing,hom_027,calm,Are you worried about what your caregiver will say tonight? ,N,Positive ,4,,,
Crush on the swim team,You are on the local swim team. Your crush just joined and now they'll be able to see you in a swimsuit. You think about this and feel ,You remember that they will be focused on swimming and everyone else will be wearing swimsuits too. This makes you feel ,https://drive.google.com/file/d/14PpW4hP6WC0D2w8vTG9u7dihy5qj4aKs/view?usp=sharing,soc_026,insecure; comforted,Do you feel okay wearing your swimsuit in front of them?,Y,resilience,4,,Social,
Dentist appointment,"You have a routine dentist appointment and find out that you need some tests to check the health of your gums and teeth. After the dentist performs the tests, you continue to lie in the dentist chair while waiting for the results. You think the news from your dentist will be that your gums are",,https://drive.google.com/file/d/1PUQshZgNL6tX5cS4aP636BXA9VNXNVpq/view?usp=sharing,phys_011,healthy,Do you think you have gum disease?,N,positive ,4,,,
Running out of time,"You are taking a test in your environmental science class. You only have ten minutes left and you still have three long problems to get through. When you think about your ability to complete the test, you feel",,https://drive.google.com/file/d/10SQmYfVuHzcGYJjADi5bmTtG4gXr2V9x/view?usp=sharing,aca_076,doubtful,Will you be able to finish your test in time?,N,negative,,,,4
First time ice skating,"Your friend enjoys ice skating and convinces you to try it out. At the rink you put on the skates and step on the ice. You glide forward slowly at first, then faster, and think your chances of getting injured are",,https://drive.google.com/file/d/1aAVB9kwWR539576_DqNHC99nsv-5mvLt/view?usp=sharing,gen_008,minimal,Are you excited to try ice skating?,Y,positive,1,4,,
,,,,,,,,,,,,
,GENERAL,,,,,,,,,,,
Scenario name,Scenario,,Image,Variable name,Ending word(s),Comprehension Question,Y/N,"Type of ending (positive, negative, or resilence) ",,,,
Thinking about flying,You're watching a TV show about people travelling to other countries. The idea of taking an airplane makes you feel anxious. You think you will deal with your anxiety,,https://drive.google.com/file/d/1wnxiRUTD_wAP7gp1JGI-BwXD0_dNvvjq/view?usp=sharing,gen_011,successfully,Are you able to tolerate your feelings of anxiety about airplanes? ,Y,positive,2,4,,
The slide,"You are at a water park with a group of friends and everyone you're with wants to go on the tallest slide. As you climb the stairs, you look over the side and feel your stomach drop. You think that this ride will be","You reach the top of the stairs and your friends go down the slide. Even though you're anxious, you go down the slide and ",https://drive.google.com/file/d/1gYGD8SnyvMsNgSmeWgF1xZiAFm5Pllca/view?usp=sharing,gen_023,scary; smile,Were you able to overcome your anxiety and enjoy the tall slide? ,Y,resilience,5,2,,
Absent neighbor,"You notice that you haven't seen your older neighbor recently. You normally visit her regularly, so it is strange that you have not seen her lately. Your neighbor has probably been",,https://drive.google.com/file/d/1HxprT1WmYEd4IjHcrA4OlIk5qKi5tYzd/view?usp=sharing,gen_012,fine,Has your elder neighbor likely been sick?,N,positive,2,4,,
Missing necklace,"You get to school and realize that you are not wearing your lucky necklace. You don't remember taking it off earlier. You become a little anxious thinking about where the necklace is, and your day ends up being",,https://drive.google.com/file/d/1WvLT7ZEEv3_Rv5xKkJh9dZmhZ3lMdsw6/view?usp=sharing,gen_013,enjoyable,Is your day miserable while you worry about the necklace? ,N,positive,2,4,,
Fruit slice,"At a picnic with family, you accidentally cut your finger while slicing fruit. Because you are outside, you are not able to wash it out immediately with soap and water. In a few days, your cut will be",,https://drive.google.com/file/d/1Mu4B99f_8N1nQxTYtHOfiGj2lIRhn65P/view?usp=sharing,gen_014,healed,Are you worried the cut will become infected?,N,positive,2,5,,
Field trip,"You are on a field trip with your school to a local museum and have a group assignment to complete while you're there. You've been grouped with other students who usually don't care about getting a good grade. You start to think about how the assignment will go, and feel ",,https://drive.google.com/file/d/1BRfCeLw8RhJk4gf9kdPvA_AyVBkVFMXq/view?usp=sharing,gen_015,uneasy,Are you worried about completing the assignment?,Y,negative,2,4,,
Helping your neighbor,"You are bringing in the mail for your neighbors while they are away. On your way out of their house each day, you lock the front door and check the lock. Today you were rushing and think you forgot to check the lock, and you think the house will probably be ",,https://drive.google.com/file/d/1L06ap5ra_s6MnwpMX2bIkWHmxWYaUpYT/view?usp=sharing,gen_024,fine,Will your neighbor’s house probably be robbed?,N,positive,2,5,,
Noise outside,You are babysitting a younger kid in your neighborhood and they just went to sleep. It's dark out and you suddenly hear noises outside. You peek out the window and see a ,,https://drive.google.com/file/d/11Vs9sz9BDAkaj5QCxD927t-mz-VTFWXn/view?usp=sharing,gen_018,cat,Was there something scary outside in the dark? ,N,positive,2,5,,
Listening to the news,This morning you overhear the news that your guardian is listening to and hear that a lot of businesses are currently downsizing. You think about what will happen if your guardian loses their job. You feel ,You notice that your guardian does not look upset while listening to the news. You think that things will be ,https://drive.google.com/file/d/16KZJVDZijOiPKkJwZWdRQfE4gNhwBtU-/view?usp=sharing,gen_005,scared; alright,Should you start to worry about your guardian's job?,N,resilience,2,4,,
Walk in the park ,Your friend convinces you to go on a walk through a local park. You have heard that there are poisonous snakes in that park and start to feel worried. You think that the chances that you will see that kind of snake are ,,https://drive.google.com/file/d/1U2_8uATTliNhBZDx61INANKTKxk7cpTi/view?usp=sharing,gen_020,small,Are you likely to get bitten by a poisonous snake?,N,positive,2,5,,
,Great job with those scenarios in your domain! Now you'll get to practice a few more scenarios that are from other domains. This will help you apply your flexible thinking skills to lots of different types of situations!,,,,,,,,,,,
Embarrassing stories,"You invited your caregiver to a school event tonight. You know that they can sometimes tell embarrassing stories about you to other people. You think about what they're going to do tonight, and feel",,https://drive.google.com/file/d/1oGNnBFehUdYBlSikTmSsRaaBV3kbk94x/view?usp=sharing,hom_027,calm,Are you worried about what your caregiver will say tonight? ,N,Positive ,4,,,
Crush on the swim team,You are on the local swim team. Your crush just joined and now they'll be able to see you in a swimsuit. You think about this and feel ,You remember that they will be focused on swimming and everyone else will be wearing swimsuits too. This makes you feel ,https://drive.google.com/file/d/14PpW4hP6WC0D2w8vTG9u7dihy5qj4aKs/view?usp=sharing,soc_026,insecure; comforted,Do you feel okay wearing your swimsuit in front of them?,Y,resilience,4,,Social,
Dentist appointment,"You have a routine dentist appointment and find out that you need some tests to check the health of your gums and teeth. After the dentist performs the tests, you continue to lie in the dentist chair while waiting for the results. You think the news from your dentist will be that your gums are",,https://drive.google.com/file/d/1PUQshZgNL6tX5cS4aP636BXA9VNXNVpq/view?usp=sharing,phys_011,healthy,Do you think you have gum disease?,N,positive ,4,,,
Running out of time,"You are taking a test in your environmental science class. You only have ten minutes left and you still have three long problems to get through. When you think about your ability to complete the test, you feel",,https://drive.google.com/file/d/10SQmYfVuHzcGYJjADi5bmTtG4gXr2V9x/view?usp=sharing,aca_076,doubtful,Will you be able to finish your test in time?,N,negative,,,,4
First time ice skating,"Your friend enjoys ice skating and convinces you to try it out. At the rink you put on the skates and step on the ice. You glide forward slowly at first, then faster, and think your chances of getting injured are",,https://drive.google.com/file/d/1aAVB9kwWR539576_DqNHC99nsv-5mvLt/view?usp=sharing,gen_008,minimal,Are you excited to try ice skating?,Y,positive,1,4,,